ID,reviewed,tracker items,label,alternative term,FGED alternative term,IEDB alternative term,ISA alternative term,NIAID GSCID-BRC alternative term,definition,definition source,example of usage,editor note,curator note,term editor,has curation status,logical type,equivalent classes,parent classes,main processes (has_part)  order process using preceded by,evaluant (realizes some ('evaluant role' and (' role of' some X))),evaluant (realizes some ('evaluant role' and ('inheres in' some X))),evaluant (X and ('has role' some 'evaluant role')),analyte (realizes some ('analyte role' and ('role of' some X),analyte (realizes some ('analyte role' and ('inheres in' some X),device,input (has_specified_input),main input,outputs X   (has_specified_output some X),outputs Y   (some X and (is_about Y)),objective,comment,associated axioms
ID,,,A rdfs:label,A alternative term SPLIT=|,A FGED alternative term SPLIT=|,A IEDB alternative term SPLIT=|,A ISA alternative term SPLIT=|,A NIAID GSCID-BRC alternative term SPLIT=|,A definition SPLIT=|,A definition source SPLIT=|,A example of usage SPLIT=|,A editor note SPLIT=|,A curator note SPLIT=|,A term editor SPLIT=|,AL has curation status,CLASS_TYPE,C %,C %,C has_part some %,C (has_specified_input some %) and (realizes some ('evaluant role' and ('inheres in' some %))),C (has_specified_input some %) and (realizes some ('evaluant role' and ('inheres in' some %))),C (has_specified_input some %) and (realizes some ('evaluant role' and ('inheres in' some %))),C (has_specified_input some %) and (realizes some ('analyte role' and ('inheres in' some %))),C (has_specified_input some %) and (realizes some ('analyte role' and ('inheres in' some %))),C (has_specified_input some %) and (realizes some (function and ('inheres in' some %))),C has_specified_input some %,C has_specified_input some %,C has_specified_output some %,C has_specified_output some %,C achieves_planned_objective some %,,C %
OBI:0000117,FALSE,,Bernoulli trial,,,,,,is an assay where the output data is a datum with one of two values denoted success and failure.,OBI branch derived,,,,PlanAndPlannedProcess Branch,pending final vetting,subclass,,assay,,,,,,,,,,,,,,
OBI:0000185,FALSE,,imaging assay,,,,,,An imaging assay is an assay to produce a picture of an entity. definition_source: OBI.,OBI branch derived,,,,PlanAndPlannedProcess Branch,pending final vetting,subclass,,assay,,,,,,,,,,image,,,,
OBI:0000288,FALSE,,protein-protein interaction detection,,,,,,"An assay with the objective to determine interactions between proteins, such as protein-protein binding.",,,"20091101, Bjoern Peters: This class may be overly broad. Lot's of assays would seem to classify under it, and I have the feeling that the intend would be to limit this to determining protein-protein interactions as they occur within an organism, rather than e.g. peptide:MHC binding assays.",,,metadata incomplete,subclass,,assay,,,,,,,,,,,,,,
OBI:0000291,FALSE,,transcription factor binding site assay,TF binding,,,,,An assay with objective to find DNA region specifically recognized by proteins that function as transcription factors,OBI,"Transcription factor binding site identification in yeast: a comparison of high-density oligonucleotide and PCR-based microarray platforms.
Funct Integr Genomics. 2007 Oct;7(4):335-45. Epub 2007 Jul 19. PMID: 17638031","JZ: fixed inconsistency issue and relabel the term
see tracker: https://sourceforge.net/p/obi/obi-terms/767/|JZ: add equivalent axiom for classification
add alternative term 'TF binding' which was used in BCBC database",,Philippe Rocca-Serra,metadata complete,subclass,assay and (has_specified_output some ('information content entity' and ('is about' some 'transcription factor binding site'))),binding assay,,,,,,,,,,measurement datum  information content entity,sequence specific DNA binding  transcription factor binding site,,,
OBI:0000366,FALSE,,metabolite profiling,metabolite assay,,,,,metabolite profiling is a process which aims at detecting and identifying chemical entities resulting from biochemical and cellular metabolism,OBI,Metabolite profiling of human colon carcinoma - deregulation of TCA cycle and amino acid turnover. Mol Cancer. 2008 Sep 18;7(1):72. PMID: 18799019,,,Philippe Rocca-Serra,metadata complete,subclass,,assay,,,,,,,,specimen,specimen,measurement datum,,,,
OBI:0000418,FALSE,,measuring glucose concentration in blood serum,,,,,,An assay that determines the concentration of glucose molecules in a blood serum sample,,,,,Person:Bjoern Peters,metadata incomplete,subclass,,analyte assay,,blood serum specimen,,,glucose,,,,,,,,,
OBI:0000424,FALSE,,transcription profiling assay,gene expression profiling,,,transcription profiling,,"An assay which aims to provide information about gene expression and transcription activity using ribonucleic acids collected from a material entity using a range of techniques and instrument such as DNA sequencers, DNA microarrays, Northern Blot",OBI,Whole genome transcription profiling of Anaplasma phagocytophilum in human and tick host cells by tiling array analysis. BMC Genomics. 2008 Jul 31;9:364. PMID: 18671858,,,Philippe Rocca-Serra,metadata complete,subclass,assay and (achieves_planned_objective some 'transcription profiling identification objective'),analyte assay,,,,,ribonucleic acid,,,specimen and ('has part' some 'ribonucleic acid'),RNA,measurement datum,gene expression,transcription profiling identification objective,,
OBI:0000433,FALSE,,DNA sequence feature detection,,,,,,An assay with the objective to determine a sequence feature of DNA,OBI,genotyping using an Affymetrix chip,should be a defined class where interpretation of data generated by assay qualifies a DNA sequence,,Philippe Rocca-Serra|Person:Bjoern Peters,metadata incomplete,subclass,,assay,,,,,,,,deoxyribonucleic acid,DNA,measurement datum,,sequence feature identification objective,,
OBI:0000435,FALSE,,genotyping assay,"genotype profiling, SNP genotyping",,,SNP analysis,,an assay which generates data about a genotype from a specimen of genomic DNA. A variety of techniques and instruments can be used to produce information about sequence variation at particular genomic positions.,OBI Biomaterial,High-throughput genotyping of oncogenic human papilloma viruses with MALDI-TOF mass spectrometry. Clin Chem. 2008 Jan;54(1):86-92. Epub 2007 Nov 2.PMID: 17981923,,,Philippe Rocca-Serra,metadata complete,subclass,has_specified_output some 'genotype information',analyte assay,,,,,deoxyribonucleic acid,,,specimen and ('has part' some deoxyribonucleic acid),DNA,genotype information,,sequence feature identification objective,,
OBI:0000438,FALSE,,DNA sequence variation detection,,,,,,"DNA sequence variation detection is a process which aims at finding changes (expansion, amplification, deletion, mutation) in sequence of DNA molecule.",OBI Biomaterial,Capturing genomic signatures of DNA sequence variation using a standard anonymous microarray platform. Nucleic Acids Res. 2006;34(18):e121. PMID: 17000641,,,Philippe Rocca-Serra,ready for release,subclass,,assay,,,,,,,,deoxyribonucleic acid,DNA,measurement datum,,sequence feature identification objective,,
OBI:0000443,FALSE,,analyte assay,,,,,,"An assay with the objective to capture information about the presence, concentration, or amount of an analyte in an evaluant.","PERSON:Bjoern Peters
PERSON:Helen Parkinson
PERSON:Philippe Rocca-Serra
PERSON:Alan Ruttenberg
GROUP:OBI Planned process branch","example of usage: In lab test for blood glucose, the test is the assay, the blood bears evaluant_role and glucose bears the analyte role. The evaluant is considered an input to the assay and the information entity that records the measurement of glucose concentration the output","logical def modified to remove expression below, as some analyte assays report below the level of detection, and therefore not a scalar measurement datum, replaced by measurement datum

and 
('has measurement unit label' some 'measurement unit label') and 
('is quality measurement of' some 'molecular concentration'))|2013-09-23: simplify equivalent axiom|Note: is_realization of some analyte role isn't always true, for example when there is none of the analyte in the evaluant. For the moment we are writing it this way, but when the information ontology is further worked out this will be replaced with a condition discussing the measurement.",,"PERSON:Bjoern Peters, Helen Parkinson, Philippe Rocca-Serra, Alan Ruttenberg",ready for release,subclass,achieves_planned_objective some 'analyte measurement objective',assay,,,,,,,,,,measurement datum,,,,
OBI:0000445,FALSE,,mass measurement assay,,,,,,a process to determine the mass of an evaluant,OBI,The patients was weighed and mass was determined to be 47 kilograms,,,Helen Parkinson,metadata complete,subclass,,assay,,material entity,,material entity,,,,material entity,material entity,mass measurement datum,,,,
OBI:0000447,FALSE,,intra cellular electrophysiology recording,,,,,,An intracellular electrophysiology recording is a process where the recording location of the electrode is intracellular,PERSON: Frank Gibson,,,,PERSON: Frank Gibson,metadata incomplete,subclass,,assay,,,,,,,,,,mass measurement datum,ion channel activity,,,
OBI:0000454,FALSE,,extracellular electrophysiology recording,,,,,,An extracellular electrophysiology recording is process where the recording location of the electrode is extracellular and data,PERSON: Frank Gibson,"The recording of a spike train in the caudate nucleus of a monkey where the electrodes are extra cellular, i.e. not in the neuron",,,"PERSON: Frank Gibson, Helen Parkinson",metadata complete,subclass,,assay,,,,,,,,,,mass measurement datum,ion channel activity,,,
OBI:0000470,FALSE,,mass spectrometry assay,,,,,,An assay that identifies the amount and type of material entities present in a sample by fragmenting it and measuring the mass-to-charge ratio of the resulting particles.,Philippe Rocca-Serra,"Identification of a proteins cut out from a 2D gel by cleaving it into peptides using trypsin digestion using electrospray ionizatino to ensure the peptides are charged, and accelerating them with an electro magnetic field in which the flight path is determined by the mass / charge ratio of the peptides. Comparing the mass/charge ratio of peptides in the proteins with databases of protein sequences allows to identify which protein gave rise to the peptides.",,,Philippe Rocca-Serra,,subclass,,assay,,,,,,,mass spectrometer  (using has_specified_input),,,,,,Specify the function realized in the assay,assay and ((realizes some (function and ('inheres in' some 'mass spectrometer'))) and (has_specified_input some 'mass spectrometer'))
OBI:0000520,FALSE,,clinical chemistry assay,detection of analyte in blood sample|chemical pathology,,,clinical chemistry,,a process which uses analytical methods to produce measurements and data on the concentration of a chemical parameters (analytes) present in a bodily fluid collected from an organism.,adapted from Wikipedia,"Influence of hydroxyethyl starch (6% HES 130/0.4) administration on hematology and clinical chemistry parameters.
Mueller T, Schimetta W, Dieplinger B, Loeffler P, Rehm M, Kreimeier U, Poelz W, Haltmayer M.
Clin Chem Lab Med. 2008;46(4):558-62.
PMID: 18605936","3/26/09: There needs to be a restriction set that specifies which type of evaluants are used in the assay, somewhere along the lines of 'sample derived of bodily fluid'",,Person: Philippe Rocca-Serra,metadata complete,subclass,,analyte assay,,material entity,,,scattered molecular aggregate,,,,,,,,,
OBI:0000537,FALSE,,copy number variation profiling,CNV analysis,,,,,"copy number variation profiling is a process which aims to provide information about lost or amplified genomic regions of DNA by comparing genomic DNA originated from tissues from same or different individuals using specific techniques such as CGH, array CGH, SNP genotyping.",,"Profiling of copy number variations (CNVs) in healthy individuals from three ethnic groups using a human genome 32 K BAC-clone-based array.
de Ståhl TD, Sandgren J, Piotrowski A, Nord H, Andersson R, Menzel U, Bogdan A, Thuresson AC, Poplawski A, von Tell D, Hansson CM, Elshafie AI, Elghazali G, Imreh S, Nordenskjí_ld M, Upadhyaya M, Komorowski J, Bruder CE, Dumanski JP.
Hum Mutat. 2008 Mar;29(3):398-408. PMID: 18058796",,,Philippe Rocca-Serra,metadata complete,subclass,,assay,,,,,,,,,,measurement datum,genetic characteristics information,,,
OBI:0000615,FALSE,,protein expression profiling,proteomic analysis,,,,,"a planned process which aims to provide information about protein expression and translation activity using protein extracts collected from a material entity using a range of techniques and instrument such as Mass spectrometers, Gel electrophoresis, Western Blots, Protein microarrays",OBI branch derived,"Protein Expression Profiling During Chick Retinal Maturation: A Proteomics-based approach.
Finnegan S, Robson JL, Wylie M, Healy A, Stitt AW, Curry WJ.
Proteome Sci. 2008 Dec 10;6(1):34.PMID: 19077203",,,Phlippe Rocca-Serra,metadata complete,subclass,,assay,,,,,,,,,,,,,,
OBI:0000623,FALSE,,NMR spectroscopy,Nuclear magnetic resonance spectroscopy,,,,,NMR spectroscopy is a process which exploits the magnetic properties of certain nuclei (those with a spin) to resonate when placed in particular magnetic field conditions. Instruments recording NMR spectrum and sets of analysis can be used to deduce  identity of chemical as well as composition of complex chemical mixtures.,adapted from Wikipedia,"Metabolic profiling studies on the toxicological effects of realgar in rats by (1)H NMR spectroscopy.  Wei L, Liao P, Wu H, Li X, Pei F, Li W, Wu Y. Toxicol Appl Pharmacol. 2008 Nov 25. PMID: 19073202",,,Philippe Rocca-Serra,metadata incomplete,subclass,,assay,,,,,,,,,,,,,,
OBI:0000626,FALSE,,DNA sequencing,,,,nucleotide sequencing,,DNA sequencing is a sequencing process which uses deoxyribonucleic acid as input and results in a the creation of DNA sequence information artifact using a DNA sequencer instrument.,OBI Branch derived,"Genomic deletions of OFD1 account for 23% of oral-facial-digital type 1 syndrome after negative DNA sequencing. Thauvin-Robinet C, Franco B, Saugier-Veber P, Aral B, Gigot N, Donzel A, Van Maldergem L, Bieth E, Layet V, Mathieu M, Teebi A, Lespinasse J, Callier P, Mugneret F, Masurel-Paulet A, Gautier E, Huet F, Teyssier JR, Tosi M, Frí©bourg T, Faivre L.  Hum Mutat. 2008 Nov 19. PMID: 19023858",,,Philippe Rocca-Serra,metadata incomplete,subclass,(has_specified_input some ('deoxyribonucleic acid' and ('has role' some 'evaluant role'))) and (has_specified_output some 'DNA sequence data'),sequencing assay,,,,deoxyribonucleic acid,,,DNA sequencer,deoxyribonucleic acid,DNA,DNA sequence data,,,,
OBI:0000630,FALSE,,hematology,"blood analysis, haematology",,,,,hematology is a process studying blood and blood producing organs relying on a variety of techniques and instruments,OBI branch derived,"Co-associations between insulin sensitivity and measures of liver function, subclinical inflammation, and hematology. 
Godsland IF, Johnston DG. 
Metabolism. 2008 Sep;57(9):1190-7. 
PMID: 18702943",,,Philippe Rocca-Serra,metadata incomplete,subclass,,assay,,,,,,,,,,information content entity,hemopoiesis,,,
OBI:0000634,FALSE,,DNA methylation profiling assay,,,,DNA methylation profiling,,an assay which aims to provide information about state of methylation of DNA molecules using genomic DNA collected from a material entity using a range of techniques and instrument such as DNA sequencers and often relying on treatment with bisulfites to ensure cytosine conversion.,OBI branch derived,"Genome-wide, high-resolution DNA methylation profiling using bisulfite-mediated cytosine conversion.  Reinders J, Delucinge Vivier C, Theiler G, Chollet D, Descombes P, Paszkowski J. 
Genome Res. 2008 Mar;18(3):469-76. Epub 2008 Jan 24.  PMID: 18218979",,,Philippe Rocca-Serra,ready for release,subclass,has_specified_output some ('information content entity' and ('is about' some 'regulation of DNA methylation')),"analyte assay, epigenetic modification assay",,,,,deoxyribonucleic acid,,,specimen and ('has part' some deoxyribonucleic acid),DNA,information content entity,regulation of DNA methylation,epigenetic modification identification objective,,
OBI:0000693,FALSE,,MeDIP-seq assay,Methylated DNA immunoprecipitation sequencing assay,,,,,"is an assay which aims at identifying methylated sites in genomic DNA and determining methylation pattern that affect  gene transcription by relying on immunoprecipitation of methylated genomic DNA, creation of a library of corresponding DNA fragments (either single or paired-end fragments) and subsequent sequencing using parallelized sequencing methods.",adapted from wikipedia,"PMID: 18612301. A Bayesian deconvolution strategy for immunoprecipitation-based DNA methylome analysis. Down TA, Rakyan VK, Turner DJ, Flicek P, Li H, Kulesha E, Grí_f S, Johnson N, Herrero J, Tomazou EM, Thorne NP, Bí_ckdahl L, Herberth M, Howe KL, Jackson DK, Miretti MM, Marioni JC, Birney E, Hubbard TJ, Durbin R, Tavarí© S, Beck S. Nat Biotechnol. 2008 Jul;26(7):779-85.",,,Philippe Rocca-Serra,metadata complete,subclass,,"DNA methylation profiling assay, assay using chromatin immunoprecipitation, sequencing assay","immunoprecipitation, library preparation, Helicos sequencing or SOLiD sequencing or Solexa sequencing or pyrosequencing",,,deoxyribonucleic acid,,,,deoxyribonucleic acid,DNA,sequence data,"regulation of DNA methylation, primary structure of DNA macromolecule, regulation of DNA methylation",,,
OBI:0000695,FALSE,,chain termination sequencing,Sanger sequencing|dye terminator sequencing,,,,,"is a DNA sequencing which rely on the use of dideoxynucleotides used in 4 distinct sequencing reaction on the same DNA sample. The dideoxynucleotides, once incorporated in the complementary DNA strand being synthesized by the DNA polymerase prevent any further chain elongation. The newly generated sequences are resolved on a polyacrylamide gel using electrophoresis and labels (either fluorochrome or radioactivity) are used to determine the nucleotide present at a given position",adapted from wikipedia,"PMID: 271968. DNA sequencing with chain-terminating inhibitors.
Sanger F, Nicklen S, Coulson AR. Proc Natl Acad Sci U S A. 1977 Dec;74(12):5463-7.",,,Philippe Rocca-Serra,metadata complete,subclass,,DNA sequencing by synthesis,,,,,,,ABI 377 automated sequencer or Li-Cor 4300 DNA Analysis System,PCR product,PCR product,,,,,
OBI:0000697,FALSE,,Helicos sequencing,true single molecule sequencing,,,,,is a DNA sequencing which allows sequence identification of billions of DNA molecules immobilized to a surface by using DNA polymerase and fluorescently labeled nucleotides added one at a time. The sequencing process does not requires amplification step and is typically able to produce reads of 25 base pair length.,adapted from wikipedia,"PMID: 18388294. Single-molecule DNA sequencing of a viral genome.
Harris TD, Buzby PR, Babcock H, Beer E, Bowers J, Braslavsky I, Causey M, Colonell J, Dimeo J, Efcavitch JW, Giladi E, Gill J, Healy J, Jarosz M, Lapen D, Moulton K, Quake SR, Steinmann K, Thayer E, Tyurina A, Ward R, Weiss H, Xie Z. Science. 2008 Apr 4;320(5872):106-9.",,,Philippe Rocca-Serra,metadata complete,subclass,,DNA sequencing by synthesis,,,,,,,HeliScope SIngle Molecule Sequencer,,,,,,,
OBI:0000699,FALSE,,survival assessment,,,,,,Survival assessment is an assay that measures the occurrence of death events in one or more organisms that are monitored over time,,,Need to point out more specifically that survival / death is measured.,,,metadata incomplete,subclass,,assay,,,,,,,,organism,organism,survival rate,organism,,,
OBI:0000706,FALSE,,SOLiD sequencing,,,,,,"is a DNA sequencing which allows sequence identification by relying on the following steps:
1. Primers hybridize to the P1 adapter sequence within the library template.
2. A set of four fluorescently labeled di-base probes compete for ligation to the sequencing primer. Specificity of the di-base probe is achieved by interrogating every 1st and 2nd base in each ligation reaction.
3. Multiple cycles of ligation, detection and cleavage are performed with the number of cycles determining the eventual read length.
4. Following a series of ligation cycles, the extension product is removed and the template is reset with a primer complementary to the n-1 position for a second round of ligation cycles",adapted from Wikipedia and Applied Biosystems web site,"PMID: 19119315. High-resolution analysis of the 5'-end transcriptome using a next generation DNA sequencer.  Hashimoto S, Qu W, Ahsan B, Ogoshi K, Sasaki A, Nakatani Y, Lee Y, Ogawa M, Ametani A, Suzuki Y, Sugano S, Lee CC, Nutter RC, Morishita S, Matsushima K. PLoS One. 2009;4(1):e4108.",,,Philippe Rocca-Serra,metadata complete,subclass,,DNA sequencing by ligation,,,,,,,AB SOLiD System,"DNA ligase, paired-end library or single fragment library",reagent,,,,,
OBI:0000716,FALSE,,ChIP-seq assay,chromatin immunoprecipitation sequencing assay,,,,,"an assay which aims at identifying protein binding sites in genomic DNA and determining how protein may regulate gene transcription by relying on immunoprecipitation of DNA bound protein, creation of a library of corresponding DNA fragments  (either single or paired-end fragments) and subsequent sequencing using parallelized sequencing methods.",adapted from Wikipedia,"PMID: 19275939
ChIP-seq: using high-throughput sequencing to discover protein-DNA interactions.
Schmidt D, Wilson MD, Spyrou C, Brown GD, Hadfield J, Odom DT.
Methods. 2009 Jul;48(3):240-8. Epub 2009 Mar 9.",,"made some modification based on the discussion on 2011/4/4 obi dev call, using DNA sequencing instead of union of some specific DNA sequencing processes",Philippe Rocca-Serra,ready for release,subclass,,"assay using chromatin immunoprecipitation, epigenetic modification assay, sequencing assay","DNA sequencing, immunoprecipitation, library preparation",,,,deoxyribonucleic acid,,DNA sequencer,specimen and ('has part' deoxyribonecleic acid and protein complex),DNA  protein complex,information content entity,"chromatin remodeling or regulation of molecular function, epigenetic or sequence-specific DNA binding or transcription factors","epigenetic modification identification objective, protein and DNA interaction identification objective",,
OBI:0000721,FALSE,,glucose tolerance test,,,,,,"is a process in  which following administration of a bolus a glucose in-vivo, glucose clearance from blood plasma is monitored over time by repeated glucose measurement in blood serum. the output of a process is a measure which can be used to evaluate the severity of insulin resistance or the efficiency of glucose clearance.",NuGO OBI plan branch,"PMID: 19527607
Using the 100-g Oral Glucose Tolerance Test to Predict Fetal and Maternal Outcomes in Women with Gestational Diabetes Mellitus.
Lin CH, Wen SF, Wu YH, Huang MJ.
Chang Gung Med J. 2009 May-Jun;32(3):283-9.","30-10-2013:[author: PRS] removing ""realizes some (concretizes some 'time series design')"" axiom as it causes 'gtt' to be classified under study design execution instead of assay",,Philippe Rocca-Serra,ready for release,subclass,,assay,"measuring glucose concentration in blood serum, data transformation. administering substance in vivo",is_proxy_for some 'Insulin resistance',,,,,,,information content entity,information content entity  graph,is_proxy_for some 'Insulin resistance',biological feature identification objective,Include data transformation as part of assay,has part' some ('data transformation' and (has_specified_input some 'measurement datum') and (has_specified_output some graph))
OBI:0000723,FALSE,,DNA sequencing by ligation,,,,,,is a DNA sequencing which relies on DNA ligase activity to perform chain extension during the sequencing reaction step.,,"PMID: 19546169. Sequence and structural variation in a human genome uncovered by short-read, massively parallel ligation sequencing using two base encoding.
McKernan KJ, Peckham HE, Costa G, McLaughlin S, Tsung E, Fu Y, 
Clouser C, Dunkan C, Ichikawa J, Lee C, Zhang Z, Sheridan A, Fu H, Ranade S, Dimilanta E, Sokolsky T, Zhang L, Hendrickson C, Li B, Kotler L, Stuart J, Malek J, Manning J, Antipova A, Perez D, Moore M, Hayashibara K, Lyons M, Beaudoin R, Coleman B, Laptewicz M, Sanicandro A, Rhodes M, De La Vega F, Gottimukkala RK, Hyland F, Reese M, Yang S, Bafna V, Bashir A, Macbride A, Aklan C, Kidd JM, Eichler EE, Blanchard AP. Genome Res. 2009 Jun 22.",PERSON: Philippe Rocca-Serra,,,metadata incomplete,subclass,,DNA sequencing,,,,,,,,DNA ligase,reagent,,,,,
