OBI:0001006,FALSE,,CMCT structure mapping assay,single nucleotide resolution mapping assay using CMCT probe,,,,,a single-nucleotide-resolution nucleic acid structure mapping assay which uses CMCT as reagent and chemical probe to generate data and information at nucleotide resolution scale contributing to the determination of nucleic acid secondary structure,RNA ontology,PMID:2422386 and PMID:2446263,,,Person: Philippe Rocca-Serra,ready for release,subclass,,single-nucleotide-resolution nucleic acid structure mapping assay using chemical probing,,,,,,,,deoxyribonucleic acid or ribonucleic acid,DNA or RNA,measurement datum,secondary structure of sequence macromolecule,,,
OBI:0001008,FALSE,,MPE-Fe(II) structure mapping assay,single nucleotide resolution mapping assay using Fe-MP probe,,,,,a single-nucleotide-resolution ribonucleic acid structure mapping assay which uses Fe-MP as reagent and chemical probe to generate data and information at nucleotide resolution scale contributing to the determination of nucleic acid secondary structure,RNA ontology,PMID:6209709,,,Person: Philippe Rocca-Serra,ready for release,subclass,,single-nucleotide-resolution nucleic acid structure mapping assay using chemical probing,,,,,,,,ribonucleic acid,RNA,measurement datum,secondary structure of RNA molecule,,,
OBI:0001011,FALSE,,ENU structure mapping assay,single nucleotide resolution mapping assay using ENU probe,,,,,a single-nucleotide-resolution nucleic acid structure mapping assay which uses ENU as reagent and chemical probe to generate data and information at nucleotide resolution scale contributing to the determination of nucleic acid secondary structure,RNA ontology,PMID:7002606 and PMID:2446263,,,Person: Philippe Rocca-Serra,ready for release,subclass,,single-nucleotide-resolution nucleic acid structure mapping assay using chemical probing,,,,,,,,deoxyribonucleic acid or ribonucleic acid,DNA or RNA,measurement datum,secondary structure of RNA molecule,,,
OBI:0001012,FALSE,,RNASE V1 structure mapping assay,single nucleotide resolution mapping assay using RNAse V1,,,,,a single-nucleotide-resolution ribonucleic acid structure mapping assay which uses RNAse V1 as reagent and enzymatic probe to generate data and information at nucleotide resolution scale contributing to the determination of nucleic acid secondary structure,RNA ontology,PMID:7031604,,,Person:Philippe Rocca-Serra,ready for release,subclass,,single-nucleotide-resolution nucleic acid structure mapping assay using enzymatic probing,,,,,,,,ribonucleic acid,RNA,measurement datum,secondary structure of RNA molecule,,,
OBI:0001013,FALSE,,kethoxal structure mapping assay,,,,,,is a single-nucleotide-resolution nucleic acid structure mapping assay which uses kethoxal as reagent and chemical probe to generate data and information at nucleotide resolution scale contributing to the determination of nucleic acid secondary structure,RNA ontology,single nucleotide resolution mapping assay using Kethoxal probe,,,Person: Philippe Rocca-Serra,ready for release,subclass,,single-nucleotide-resolution nucleic acid structure mapping assay using chemical probing,,,,,,,,deoxyribonucleic acid or ribonucleic acid,DNA or RNA,measurement datum,secondary structure of sequence macromolecule,,,
OBI:0001014,FALSE,,single-nucleotide-resolution nucleic acid structure mapping assay using enzymatic probing,,,,,,a single-nucleotide-resolution nucleic acid structure mapping assay which relies on proteins acting as enzymatic probes  in order to produce measurement information which one interpreted provide structural information about the RNA species under study.,RNAO and OBI,,,,Person: Philippe Rocca-Serra,ready for release,subclass,realizes some ('catalytic activity' and ('inheres in' some protein)),single-nucleotide-resolution nucleic acid structure mapping assay,,,,,,,,,,,,,,
OBI:0001015,FALSE,,DMS structure mapping assay,single nucleotide resolution mapping assay using DMS probe,,,,,a single-nucleotide-resolution nucleic acid structure mapping assay which uses DMS as reagent and chemical probe to generate data and information at nucleotide resolution scale contributing to the determination of nucleic acid secondary structure,RNA Ontology,PMID:6159633 and PMID:2446263,,,Person: Philippe Rocca-Serra,ready for release,subclass,,single-nucleotide-resolution nucleic acid structure mapping assay using chemical probing,,,,,,,,deoxyribonucleic acid or ribonucleic acid,DNA or RNA,measurement datum,secondary structure of sequence macromolecule,,,
OBI:0001016,FALSE,,DNASE 1 structure mapping assay,single nucleotide resolution mapping assay using DNAse I|DNAse footprinting assay,,,,,a single-nucleotide-resolution deoxyribonucleic acid structure mapping assay which uses DNAse 1 as reagent and enzymatic probe to generate data and information at nucleotide resolution scale contributing to the determination of nucleic acid secondary structure,RNA ontology,PMID:3773731,,,Person:Philippe Rocca-Serra,ready for release,subclass,,single-nucleotide-resolution nucleic acid structure mapping assay using enzymatic probing,,,,,,,,deoxyribonucleic acid,DNA,measurement datum,secondary structure of sequence macromolecule,,,
OBI:0001017,FALSE,,single-nucleotide-resolution nucleic acid structure mapping assay using chemical probing,,,,,,a single-nucleotide-resolution nucleic acid structure mapping assay which relies on small chemical compounds acting as chemical probes  in order to produce measurement information which one interpreted provide structural information about the RNA species under study.,RNAO and OBI,,,,Person: Philippe Rocca-Serra,ready for release,subclass,(realizes some ('reagent role' and ('inheres in' some ('molecular entity' or 'nucleic acid')))) and (has_specified_output some ('measurement datum' and ('is about' some 'secondary structure of sequence macromolecule'))),single-nucleotide-resolution nucleic acid structure mapping assay,,,,,,,,,,measurement datum,secondary structure of sequence macromolecule,,specified 'reagent role',
OBI:0001018,FALSE,,Rhodium DNA structure mapping assay,single nucleotide resolution mapping assay using Rhodium probe,,,,,a single-nucleotide-resolution nucleic acid structure mapping assay which uses Rhodium as reagent and chemical probe to generate data and information at nucleotide resolution scale contributing to the determination of nucleic acid secondary structure,RNA ontology,PMID:2843807,,,Person:Philippe Rocca-Serra,ready for release,subclass,,single-nucleotide-resolution nucleic acid structure mapping assay using chemical probing,,,,,,,,deoxyribonucleic acid or ribonucleic acid,DNA or RNA,measurement datum,secondary structure of sequence macromolecule,,,
OBI:0001019,FALSE,,RNA ADA I RNA structure mapping assay,single nucleotide resolution mapping assay using RNA adenosine deaminase I,,,,,a single-nucleotide-resolution ribonucleic acid structure mapping assay which uses RNA adenosine deaminase I as reagent and enzymatic probe to generate data and information at nucleotide resolution scale contributing to the determination of nucleic acid secondary structure,RNA ontology,PMID:7527340,,,Person: Philippe Rocca-Serra,ready for release,subclass,,single-nucleotide-resolution nucleic acid structure mapping assay using enzymatic probing,,,,,,,,ribonucleic acid,RNA,measurement datum,secondary structure of RNA molecule,,,
OBI:0001020,FALSE,,Lead structure mapping assay,single nucleotide resolution mapping assay using Lead probe,,,,,a single-nucleotide-resolution nucleic acid structure mapping assay which uses lead as reagent and chemical probe to generate data and information at nucleotide resolution scale contributing to the determination of nucleic acid secondary structure,RNA ontology,PMID:2686708,,,Person:Philippe Rocca-Serra,ready for release,subclass,,single-nucleotide-resolution nucleic acid structure mapping assay using chemical probing,,,,,,,,deoxyribonucleic acid or ribonucleic acid,DNA or RNA,measurement datum,secondary structure of sequence macromolecule,,,
OBI:0001021,FALSE,,RNASE T2 structure mapping assay,single nucleotide resolution mapping assay using RNAse T2,,,,,a single-nucleotide-resolution ribonucleic acid structure mapping assay which uses RNAse T2 as reagent and enzymatic probe to generate data and information at nucleotide resolution scale contributing to the determination of nucleic acid secondary structure,RNA ontology,PMID:6207483,,,Person:Philippe Rocca-Serra,ready for release,subclass,,single-nucleotide-resolution nucleic acid structure mapping assay using enzymatic probing,,,,,,,,ribonucleic acid,RNA,measurement datum,secondary structure of RNA molecule,,,
OBI:0001022,FALSE,,gene dosage assay,,,,,,"an assay of changes in phenotype due to increased or decreased
dosage of a single allele of a gene.",David Osumi Sutherland,,,,PERSON: Bjoern Peters,metadata complete,subclass,,assay,,,,,,,,,,,,,,
OBI:0001023,FALSE,,Fe-BABE RNA structure mapping assay,single nucleotide resolution mapping assay using Fe-BABE probe,,,,,a single-nucleotide-resolution ribonucleic acid structure mapping assay which uses Fe-BABE as reagent and chemical probe to generate data and information at nucleotide resolution scale contributing to the determination of nucleic acid secondary structure,RNA ontology,PMID: 7862644,,,Person:Philippe Rocca-Serra,ready for release,subclass,,single-nucleotide-resolution nucleic acid structure mapping assay using chemical probing,,,,,,,,ribonucleic acid,RNA,measurement datum,secondary structure of RNA molecule,,,
OBI:0001024,FALSE,,RNASE U2 structure mapping assay,single nucleotide resolution mapping assay using RNAse U2,,,,,a single-nucleotide-resolution ribonucleic acid structure mapping assay which uses RNAase U2 as reagent and enzymatic probe to generate data and information at nucleotide resolution scale contributing to the determination of nucleic acid secondary structure,RNA ontology,PMID:409999,,,Person:Philippe Rocca-Serra,ready for release,subclass,,single-nucleotide-resolution nucleic acid structure mapping assay using enzymatic probing,,,,,,,,ribonucleic acid,RNA,measurement datum,secondary structure of RNA molecule,,,
OBI:0001025,FALSE,,binding constant determination assay,,,,,,A binding assay where the specified output is a binding constant,,Determination of KD value for an antibody binding a protein using a BIACORE assay.,,,"PERSON: Bjoern Peters, Randi Vita, Jason Greenbaum",metadata incomplete,subclass,binding assay' and (has_specified_output some 'binding constant'),binding assay,,,,,,,,,,binding constant,,,,
OBI:0001026,FALSE,,NMIA RNA structure mapping assay,single nucleotide resolution mapping assay using NMIA probe|SHAPE mapping assay,,,,,a single-nucleotide-resolution ribonucleic acid structure mapping assay which uses NMIA as reagent and chemical probe to generate data and information at nucleotide resolution scale contributing to the determination of nucleic acid secondary structure,RNA ontology,PMID: 15796531,,,Person:Philippe Rocca-Serra,ready for release,subclass,,single-nucleotide-resolution nucleic acid structure mapping assay using chemical probing,,,,,,,,ribonucleic acid,RNA,measurement datum,secondary structure of RNA molecule,,,
OBI:0001027,FALSE,,Terbium RNA structure mapping assay,single nucleotide resolution mapping assay using Terbium probe,,,,,a single-nucleotide-resolution nucleic acid structure mapping assay which uses Terbium as reagent and chemical probe to generate data and information at nucleotide resolution scale contributing to the determination of nucleic acid secondary structure,RNA ontology,PMID:10772868,,,Person:Philippe Rocca-Serra,ready for release,subclass,,single-nucleotide-resolution nucleic acid structure mapping assay using chemical probing,,,,,,,,ribonucleic acid,RNA,measurement datum,secondary structure of RNA molecule,,,
OBI:0001029,FALSE,,OH-radical structure mapping assay,single nucleotide resolution mapping assay using OH-radical probe|MOHCA assay|OH footprinting assay,,,,,a single-nucleotide-resolution nucleic acid structure mapping assay which uses hydroxyl radical as reagent and chemical probe to generate data and information at nucleotide resolution scale contributing to the determination of nucleic acid secondary structure,RNA ontology,PMID:2501870,,,Person:Philippe Rocca-Serra,ready for release,subclass,,single-nucleotide-resolution nucleic acid structure mapping assay using chemical probing,,,,,,,,deoxyribonucleic acid or ribonucleic acid,DNA or RNA,measurement datum,secondary structure of sequence macromolecule,,,
OBI:0001030,FALSE,,RNASE T1 structure mapping assay,single nucleotide resolution mapping assay using RNAse T1,,,,,a single-nucleotide-resolution ribonucleic acid structure mapping assay which uses RNAse T1 as reagent and enzymatic probe to generate data and information at nucleotide resolution scale contributing to the determination of nucleic acid secondary structure,RNA ontology,PMID:114514,,,Person:Philippe Rocca-Serra,ready for release,subclass,,single-nucleotide-resolution nucleic acid structure mapping assay using enzymatic probing,,,,,,,,ribonucleic acid,RNA,measurement datum,secondary structure of RNA molecule,,,
OBI:0001035,FALSE,,Nuclease S1 structure mapping assay,single nucleotide resolution mapping assay using Nuclease S1,,,,,a single-nucleotide-resolution deoxyribonucleic acid structure mapping assay which uses DNAse 1 as reagent and enzymatic probe to generate data and information at nucleotide resolution scale contributing to the determination of nucleic acid secondary structure,RNA ontology,PMID:363143,,,Person: Philippe Rocca-Serra,ready for release,subclass,,single-nucleotide-resolution nucleic acid structure mapping assay using enzymatic probing,,,,,,,,ribonucleic acid,RNA,measurement datum,secondary structure of sequence macromolecule,,,
OBI:0001038,FALSE,,Ruthenium structure mapping assay,,,,,,is a single-nucleotide-resolution nucleic acid structure mapping assay which uses Rhutenium as reagent and chemical probe to generate data and information at nucleotide resolution scale contributing to the determination of nucleic acid secondary structure,RNAOntology,PMID:3016894,,,Person:Philippe Rocca-Serra,ready for release,subclass,,single-nucleotide-resolution nucleic acid structure mapping assay using chemical probing,,,,,,,,deoxyribonucleic acid or ribonucleic acid,DNA or RNA,measurement datum,secondary structure of RNA molecule,,,
OBI:0001039,FALSE,,inline probing RNA structure mapping,,,,,,is a single-nucleotide-resolution ribonucleic acid structure mapping assay which uses intromolecular reactivity to generate data and information at nucleotide resolution scale contributing to the determination of nucleic acid secondary structure,RNA ontology,PMID:10573122 and PMID: 18369975,,,Person: Philippe Rocca-Serra,ready for release,subclass,,single-nucleotide-resolution nucleic acid structure mapping assay using chemical probing,,,,,,,,ribonucleic acid,RNA,measurement datum,secondary structure of RNA molecule,,,
OBI:0001146,FALSE,,binding assay,,,,,,An assay with the objective to characterize the disposition of two or more material entities to form a complex.,"PERSON:Bjoern Peters, Randi Vita, Jason Greenbaum","Determination of KD value for an antibody binding a protein using a BIACORE assay. Using plate bound antigen in an ELISA to determine if a mixture of serum antibodies bind the antigen.nnThe following are NOT binding assays, as the desired output is not binding data: RNA microarray experiments to determine levels of gene expression. ChIP experiments to determine where in DNA a transcription factor binds. Using an IL-2 antibody on an ELISA plate to determine presence of IL-2 after stimulating a T cell culture. ",,,"PERSON:Bjoern Peters, Randi Vita, Jason Greenbaum",,subclass,assay and (has_specified_output some ('is about' some binding)),assay,,,,,,,,,,binding datum,,,,
OBI:0001158,FALSE,,age measurement assay,,,,,,"An assay that measures the duration of temporal interval of a process that is part of the life of the bearer, where the initial time point of the measured process is the beginning of some transitional state of the bearer such as birth or when planted.",OBI group,,"This assay measures time not developmental stage.  we recognize that development takes different time periods under different conditions such as media / temperature. For example, age measurement assay of fly age, the output likes 28 days but not mid-life of age at room temperature.",,PERSON: Alan Ruttenberg,metadata complete,subclass,,assay,,,,,,,,,,age measurement datum,,,,
OBI:0001170,FALSE,,reverse transcription polymerase chain reaction assay,,,,,,"an assay that evaluates the concentration of RNA in a sample in which an RNA strand is first reverse transcribed into its DNA complement (complementary DNA, or cDNA) using the enzyme reverse transcriptase, and the resulting cDNA is amplified using traditional or real-time PCR. ",GROUP: Penn Group,,,,"PERSON: Chris Stoeckert, Jie Zheng",metadata complete,subclass,,assay,reverse transcribed polymerase chain reaction,,,ribonucleic acid,,,,ribonucleic acid,RNA,information content entity,gene expression,,,
OBI:0001177,FALSE,,RNA sequencing,,,,,,RNA sequencing is a sequencing process which uses ribonucleic acid as input and results in a the creation of RNA sequence information artifact,Bjoern Peters,,BP 12/21:Created based on a request from Melanie,,Bjoern Peters,metadata complete,subclass,(has_specified_input some ('ribonucleic acid' and ('has role' some 'evaluant role'))) and (has_specified_output some ('information content entity' and ('is about' some 'primary structure of RNA molecule'))),sequencing assay,,,,ribonucleic acid,,,,ribonucleic acid,RNA,information content entity,primary structure of RNA molecule,,,
OBI:0001187,FALSE,,infectious agent detection assay,,,,,,"An assay in which the presence or amount of an infectious agent in an input material is detected in an evaluant
",,"Culturing a sputum sample on agar medium to detect bacterial growth; Stain slices of liver from a mouse to count presence of infectious centers. 
","2/22/2011, BP: This should probably be an analyte assay, but the logical definition of those is currently restricted to 'scattered molecular aggregates', which excludes using infectious agents as analytes. See below
(realizes some 
    ('evaluant role'
     and (role_of some material_entity)))
 and (realizes some 
    ('analyte role'
     and (role_of some 'infectious agent')))
 and (achieves_planned_objective some 'analyte measurement objective')",,"Bjoern Peters, Randi Vita, Jason Greenbaum",metadata complete,subclass,,assay,,,,,,,,,,,,,,
OBI:0001221,FALSE,,ChIP-chip by SNP array assay,,,,,,An assay where chromatin immunoprecipitation (ChIP) is used in combination with SNP microarray technology,EFO_0002764 ChIP-chip by SNP array,,,,Group: ArrayExpress production team,metadata complete,subclass,,ChIP-chip assay,,,,,,,SNP microarray,,,,,,,
OBI:0001235,FALSE,,transcription profiling by tiling array assay,,,,,,An assay in which the transcriptome of a biological sample is analysed using a tiling path array.,EFO_0002769 transcription profiling by tiling array,,,,Person: James Malone,metadata complete,subclass,,transcription profiling assay,,,,,ribonucleic acid,,tiling microarray,specimen and ('has part' some ribonucleic acid),RNA,measurement datum,gene expression,transcription profiling identification objective,,
OBI:0001247,FALSE,,genotyping by high throughput sequencing assay,,,,,,An assay in which high througput sequencer is used to detect polymorphisms in DNA samples,EFO_0002771: genotyping by high throughput sequencing,,,,Person: James Malone,metadata complete,subclass,,genotyping assay,,,,,,,DNA sequencer,,,,,,,
OBI:0001248,FALSE,,ChIP-chip assay,ChIP-on-chip assay,,,,,"an assay that aims to investigate the interactions between protein and DNA relying on chromatin immunoprecipitation ('ChIP') combined with microarray technology ('chip'). Specially, it allows the identification of protein binding sites on a genome-wide basis.",WEB: http://en.wikipedia.org/wiki/ChIP-on-chip,,,,Person: James Malone,metadata complete,subclass,,assay using chromatin immunoprecipitation,immunoprecipitation,,,,deoxyribonucleic acid,,DNA microarray,specimen and ('has part' some 'deoxyribonucleic acid') and ('has part' some 'protein complex'),DNA and protein complex,information content entity,"chromatin remodeling or regulation of molecular function, epigenetic or sequence-specific DNA binding or 'transcription factor binding site",protein and DNA interaction identification objective,,
OBI:0001266,FALSE,,DNA methylation profiling by high throughput sequencing assay,,,,,,An assay in which the methylation state of DNA is determined and is compared between samples using sequencing based technology,EFO_0002761 methylation profiling by high throughput sequencing,,,,"Group: ArrayExpress production team, James Malone, Helen Parkinson",metadata complete,subclass,,DNA methylation profiling assay,,,,,,,DNA sequencer,,,,,,,
OBI:0001271,FALSE,,RNA-seq assay,transcription profiling by high throughput sequencing,,,,,"An assay in which sequencing technology (e.g. Solexa/454) is used to generate RNA sequence, analyse the transcibed regions of the genome, and or to quantitate transcript abundance",EFO_0002770 transcription profiling by high throughput sequencing,,,"JZ: should be inferred as 'DNA sequencing'. Will check in the future.|an assay that uses high-throughput sequencing technologies to sequence cDNA in order to get information about a sample's RNA content. RNA-Seq provides researchers with efficient ways to measure transcriptome data experimentally, allowing them to get information such as how different alleles of a gene are expressed, detect post-transcriptional mutations or identify gene fusions.

WEB: http://en.wikipedia.org/wiki/RNA-Seq",PERSON: James Malone,metadata complete,subclass,,"transcription profiling assay, sequencing assay",,,,,ribonucleic acid,,DNA sequencer,specimen and ('has part' some ribonucleic acid),RNA,sequence data,gene expression,transcription profiling identification objective,,
OBI:0001274,FALSE,,genotyping by array assay,,,,,,An assay in which an array is used to detect polymorphisms in DNA samples,EFO_0002767: genotyping by array,,,,Group: ArrayExpress production team,metadata complete,subclass,,genotyping assay,,,,,,,DNA microarray,,,,,,,
OBI:0001282,FALSE,,translation profiling assay,,,,,,"An assay in which surface-bound, translationally competent ribosome complexes are used to generate a translation profile for mRNA, which mRNA may be a single molecular species, or a combination of species, including complex mixtures such as those found in the set of mRNAs isolated from a cell or tissue. One or more components of the surface-bound ribosome complex may be labeled at specific positions to permit analysis of multiple or single molecules for determination of ribosomal conformational changes and translation kinetics. Translation profiles are used as the basis for comparison of an mRNA or set of mRNA species. The translation profile can be used to determine such characteristics as kinetics of initiation, kinetic of elongation, identity of the polypeptide product, and the like. Analysis of translation profiles may be used to determine differential gene expression, optimization of mRNA sequences for expression, screening drug candidates for an effect on translation.",EFO_0001033 translation profiling,,,,PERSON: James Malone,metadata complete,subclass,,analyte assay,,,,,ribonucleic acid,,,,,,,molecular feature identification objective,,
OBI:0001304,FALSE,,RNAi profiling by array assay,,,,,,"An assay in which double stranded RNA is synthesized with a sequence complementary to a gene(s) of interest and introduced into a cell or organism, where it is recognized as exogenous genetic material and activates the RNAi pathway resulting in knockdown of the transcripts and providing a means to study downstream changes in gene expression.",EFO_0001030 RNAi profiling by array,,,,PERSON: James Malone,metadata complete,subclass,,analyte assay,,,,,ribonucleic acid,,DNA microarray,,,,,molecular feature identification objective,,
OBI:0001318,FALSE,,proteomic profiling by array assay,,,,,,"An assay that proteins in a sample are detected, quantified or otherwise analysed, e.g. antibody profiling using an array based technology",EFO_0002765 proteomic profiling by array,,,,Person: James Malone,metadata complete,subclass,,analyte assay,,,,,protein,,protein microarray,specimen and ('has part' some protein),protein,,,molecular feature identification objective,,
OBI:0001332,FALSE,,DNA methylation profiling by array assay,,,,,,An assay in which the methylation state of DNA is determined and is compared between samples using array technology,EFO_0002759 methylation profiling by array,,,,Person: James Malone,metadata complete,subclass,,DNA methylation profiling assay,,,,,,,DNA microarray,,,,,,,
OBI:0001335,FALSE,,microRNA profiling by array assay,,,,,,An assay in which a microRNA array is used to analyse the microRNA component of the transcriptome.,EFO_0000753 microRNA profiling by array,,,,PERSON: James Malone,metadata complete,subclass,,microRNA profiling assay,,,,,ribonucleic acid,,DNA microarray,specimen and ('has part' some ribonucleic acid),RNA,measured expression level,miRNA,transcription profiling identification objective,,
